{
  "checkpoint": {
    "payload": "eyJhbGdvcml0aG0iOiJFZDI1NTE5IiwiYm9keSI6eyJkZXBsb3ltZW50X2lkIjoid2F2ZTE2LWxvY2FsLWRlbW8iLCJoZWFkX2RpZ2VzdCI6IjY4NGQ1ZDgwYmViOGIwNGVlMTZjODZiZDA3YjdhNmM5MDM4YTEyMmQyZDdhMmFhNDUwZjc2MDA3OGI3YTk2NDEiLCJyZWNlaXB0X2NvdW50Ijo5LCJyZWNlaXB0c19zaGEyNTYiOiI3ZTIyOGY5OGYyOGI0NjQ3NmJkN2RmYzFmNzhiM2I0NzMzNmVkMmM2MzJkMzBjNDE1MGQ5NGUwYTdmNDBlYWU3Iiwic2NoZW1hX3ZlcnNpb24iOiJ3YXZlMTYuY2hlY2twb2ludC52MSIsInN0cmVhbV9pZCI6IndhdmUxNi1kZW1vLXN0cmVhbSJ9LCJkZXBsb3ltZW50X2lkIjoid2F2ZTE2LWxvY2FsLWRlbW8iLCJrZXlfaWQiOiJ3YXZlMTYtZGVtby1rZXkiLCJzY2hlbWFfdmVyc2lvbiI6IndhdmUxNi5zaWduZWRfc3RhdGVtZW50LnYxIiwic2lnbmVkX2F0IjoiMjAyNi0wOS0zMFQyMDoyOTo1Mi42Njg3NjcrMDA6MDAiLCJzdHJlYW1faWQiOiJ3YXZlMTYtZGVtby1zdHJlYW0ifQ==",
    "payloadType": "application/vnd.ix-blackfox.authority-checkpoint.v16+json",
    "signatures": [
      {
        "keyid": "wave16-demo-key",
        "sig": "UqJEMKILW9KEQmS31FQTAzkj1P+wGMjQ99WGaoGOxJShiwUHgskyxFFWJlodEKOxGa9Wn+vrDu0A0rwZjhpxCw=="
      }
    ]
  },
  "deployment_id": "wave16-local-demo",
  "receipts": [
    {
      "attestation": {
        "payload": "eyJhbGdvcml0aG0iOiJFZDI1NTE5IiwiYm9keSI6eyJhdXRoZW50aWNhdGVkX3ByaW5jaXBhbCI6e30sImF1dGhvcml0eV9kZWNpc2lvbiI6eyJyZWFzb25fY29kZXMiOlsiYWdlbnRfYXV0aGVudGljYXRpb25fZmFpbGVkIl0sInN0YXR1cyI6ImJsb2NrIn0sImRlcGxveW1lbnRfaWQiOiJ3YXZlMTYtbG9jYWwtZGVtbyIsImV2YWx1YXRlZF9ldmlkZW5jZV9kaWdlc3RzIjp7fSwiZXZpZGVuY2VfcmVmcyI6W10sImV4ZWN1dGVkIjpmYWxzZSwiZXhlY3V0aW9uX3N0YXRlIjoibm90X2F0dGVtcHRlZCIsInByZXZpb3VzX3JlY2VpcHRfZGlnZXN0IjoiIiwicHJvdG9jb2wiOiJibGFja2ZveC1hcGkvdjEiLCJyZWNlaXB0X2RpZ2VzdCI6ImFjZGIxOTc5NTE4YjI1ODNhY2MwN2MyNWYwMDEwMjAzZjNkMjljZWRhYzQ3NjM0ZDRkYmNkMTQ4YmIwY2Y2ZDEiLCJyZWNlaXB0X2lkIjoid2F2ZTE2LXJlY2VpcHQtOTQ0NjQzMzlkNWQ3OGYxZDE1YzRlNmYzZTQ2OTllYzdmMDczYWE3NDlmNDJhOTUwNDBjMjgwMWQ0YjI3NTQyMSIsInJlY29yZF90eXBlIjoiZGVuaWFsIiwicmVjb3JkZWRfYXQiOiIyMDI2LTA5LTMwVDIwOjI5OjUyLjMxNzQwNCswMDowMCIsInNjaGVtYV92ZXJzaW9uIjoid2F2ZTE2LmF1dGhvcml0eV9yZWNlaXB0LnYxIiwic2VxdWVuY2UiOjEsInNpbmdsZV91c2VfZXZpZGVuY2VfY2xhaW1zIjpbXSwic3RyZWFtX2lkIjoid2F2ZTE2LWRlbW8tc3RyZWFtIiwic3ViamVjdCI6eyJhZ2VudF9pZCI6ImNvZGluZy1hZ2VudC0wNyIsInRvb2xfbmFtZSI6ImZpbGVzeXN0ZW0ud3JpdGVfZmlsZSJ9LCJ1cHN0cmVhbV9hdHRlbXB0ZWQiOmZhbHNlLCJ1cHN0cmVhbV9lcnJvciI6IkZlZGVyYXRlZCBiZWFyZXIgaWRlbnRpdHkgaXMgcmVxdWlyZWQ7IHN0YXRpYyBhZ2VudCBjcmVkZW50aWFscyBhcmUgZGlzYWJsZWQuIiwidXBzdHJlYW1fcmVzcG9uc2Vfc2hhMjU2IjoiIiwidXBzdHJlYW1fc3RhdHVzIjowfSwiZGVwbG95bWVudF9pZCI6IndhdmUxNi1sb2NhbC1kZW1vIiwia2V5X2lkIjoid2F2ZTE2LWRlbW8ta2V5Iiwic2NoZW1hX3ZlcnNpb24iOiJ3YXZlMTYuc2lnbmVkX3N0YXRlbWVudC52MSIsInNpZ25lZF9hdCI6IjIwMjYtMDktMzBUMjA6Mjk6NTIuMzE4Mjk0KzAwOjAwIiwic3RyZWFtX2lkIjoid2F2ZTE2LWRlbW8tc3RyZWFtIn0=",
        "payloadType": "application/vnd.ix-blackfox.authority-receipt.v16+json",
        "signatures": [
          {
            "keyid": "wave16-demo-key",
            "sig": "R2NUZ1Dtxuc5Sqn8Qi1xdkDHX3rgqNY375QlKnWodA47vNUNxlZKzcIBUoYtoYBs0KowVuHCaYh3z4qmNZeACw=="
          }
        ]
      },
      "authenticated_principal": {},
      "authority_decision": {
        "reason_codes": [
          "agent_authentication_failed"
        ],
        "status": "block"
      },
      "deployment_id": "wave16-local-demo",
      "evaluated_evidence_digests": {},
      "evidence_refs": [],
      "executed": false,
      "execution_state": "not_attempted",
      "previous_receipt_digest": "",
      "protocol": "blackfox-api/v1",
      "receipt_digest": "acdb1979518b2583acc07c25f0010203f3d29cedac47634d4dbcd148bb0cf6d1",
      "receipt_id": "wave16-receipt-94464339d5d78f1d15c4e6f3e4699ec7f073aa749f42a95040c2801d4b275421",
      "record_type": "denial",
      "recorded_at": "2026-09-30T20:29:52.317404+00:00",
      "schema_version": "wave16.authority_receipt.v1",
      "sequence": 1,
      "single_use_evidence_claims": [],
      "stream_id": "wave16-demo-stream",
      "subject": {
        "agent_id": "coding-agent-07",
        "tool_name": "filesystem.write_file"
      },
      "upstream_attempted": false,
      "upstream_error": "Federated bearer identity is required; static agent credentials are disabled.",
      "upstream_response_sha256": "",
      "upstream_status": 0
    },
    {
      "attestation": {
        "payload": "eyJhbGdvcml0aG0iOiJFZDI1NTE5IiwiYm9keSI6eyJhdXRoZW50aWNhdGVkX3ByaW5jaXBhbCI6eyJhZ2VudF9pZCI6ImNvZGluZy1hZ2VudC0wNyIsImF1ZGllbmNlIjoiYmxhY2tmb3gtZ2F0ZXdheSIsImF1dGhlbnRpY2F0aW9uX3R5cGUiOiJvaWRjX2p3dCIsImRlbGVnYXRpb25fY2hhaW4iOlt7ImRlbGVnYXRlZF9ieSI6Im1pc3Npb24tb3duZXIiLCJkZWxlZ2F0aW9uX2lkIjoib3duZXItdG8tYWdlbnQiLCJleHBpcmVzX2F0IjoxNzkwODAwNDkyLCJwYXRoX3Jvb3RzIjpbImRvY3MiXSwicmVwb3NpdG9yaWVzIjpbIml4LWJsYWNrZm94Il0sInRvb2xzIjpbImZpbGVzeXN0ZW0ud3JpdGVfZmlsZSJdfV0sImV4cGlyZXNfYXQiOjE3OTA4MDA0OTIsImlzc3VlZF9hdCI6MTc5MDgwMDE5MiwiaXNzdWVyIjoiaHR0cHM6Ly9pc3N1ZXIuYmxhY2tmb3gudGVzdCIsImtleV9pZCI6IndhdmUxNS1yc2EtMSIsInN1YmplY3QiOiJ3b3JrbG9hZC9jb2RpbmctYWdlbnQtMDciLCJ0b2tlbl9pZCI6IndhdmUxNi1saXZlLWp0aSJ9LCJhdXRob3JpdHlfZGVjaXNpb24iOnsiYWdlbnRfYXV0aG9yaXphdGlvbiI6eyJhbGxvd2VkIjpmYWxzZSwiYmxvY2tlZCI6ZmFsc2UsImRlY2lkZWRfYXQiOiIyMDI2LTA5LTMwVDIwOjI5OjUyLjMyMjM0MiswMDowMCIsImRlY2lzaW9uX2lkIjoiYWdlbnQtYXV0aC01Y2ZiMTNkMmI5NzUwNmUzYzZmNWQzZjEiLCJkaWdlc3QiOiJlYWI5NjQxNWU0NzRhODM0OGRjMWM1Y2JiYTNlZDExYWYzMDc3MTkzZDkyMDdhNjk1YTQxMTk1ZjQ1NTYxOTBkIiwiZXZpZGVuY2VfYXJ0aWZhY3RfaWRzIjpbInRvb2wtaW52b2NhdGlvbi10b29sLWNhbGwtZDM0M2IyZWU5NGM1NDhlNGE0ZjRiZTc1YjFhNmQ5ZDEiLCJ0b29sLW1hbmlmZXN0LWZpbGVzeXN0ZW0ud3JpdGUtZmlsZSJdLCJtZXRhZGF0YSI6e30sInJlYXNvbnMiOlsicmV2aWV3X3JlcXVpcmVkX2J5X3Njb3BlIl0sInJlcXVlc3QiOnsiYWN0aW9uIjoid3JpdGUiLCJhZ2VudF9pZCI6ImNvZGluZy1hZ2VudC0wNyIsImNhcGFiaWxpdHkiOiJ3cml0ZV93b3Jrc3BhY2UiLCJkaWdlc3QiOiIxMGFlMDlkZWVlOWQwMTk0OGVlZDlmNTRiMDJlMDE2NWVjZmQ1MDk1ZmZiOGU1MGIwZjZjZjliNzM1ZWYwMGQyIiwiZXZpZGVuY2VfYXJ0aWZhY3RfaWRzIjpbInRvb2wtaW52b2NhdGlvbi10b29sLWNhbGwtZDM0M2IyZWU5NGM1NDhlNGE0ZjRiZTc1YjFhNmQ5ZDEiLCJ0b29sLW1hbmlmZXN0LWZpbGVzeXN0ZW0ud3JpdGUtZmlsZSJdLCJqdXN0aWZpY2F0aW9uIjoiV2F2ZSAxMSBhZ2VudCBhdXRob3JpemF0aW9uIHByZWZsaWdodCBmb3IgZ292ZXJuZWQgdG9vbCBpbnZvY2F0aW9uLiIsIm1ldGFkYXRhIjp7InJlcXVlc3RlZF9ieSI6ImNvZGluZy1hZ2VudC0wNyIsInRvb2xfY2FwYWJpbGl0eSI6ImZpbGVfd3JpdGUiLCJ0b29sX2lkIjoiZmlsZXN5c3RlbS53cml0ZV9maWxlIiwidG9vbF9pbnZvY2F0aW9uX2lkIjoidG9vbC1jYWxsLWQzNDNiMmVlOTRjNTQ4ZTRhNGY0YmU3NWIxYTZkOWQxIn0sInJlcXVlc3RfaWQiOiJ0b29sLWF1dGgtdG9vbC1jYWxsLWQzNDNiMmVlOTRjNTQ4ZTRhNGY0YmU3NWIxYTZkOWQxIiwicmVxdWVzdGVkX2F0IjoiMjAyNi0wOS0zMFQyMDoyOTo1Mi4zMjIzMjIrMDA6MDAiLCJ0YXJnZXQiOnsiYXJ0aWZhY3RfaWRzIjpbXSwiZG9tYWluIjoicG9saWN5X2dvdmVybmVkIiwibWV0YWRhdGEiOnsidG9vbF9jYXBhYmlsaXR5IjoiZmlsZV93cml0ZSIsInRvb2xfaWQiOiJmaWxlc3lzdGVtLndyaXRlX2ZpbGUiLCJ0b29sX2ludm9jYXRpb25faWQiOiJ0b29sLWNhbGwtZDM0M2IyZWU5NGM1NDhlNGE0ZjRiZTc1YjFhNmQ5ZDEifSwicGFja19pZCI6IiIsInBhdGgiOiJkb2NzL21pc3NpbmcudHh0IiwicmVwb3NpdG9yeV9pZCI6Iml4LWJsYWNrZm94Iiwicmlza190aWVyIjoiaGlnaCIsInRvb2xfaWQiOiJmaWxlc3lzdGVtLndyaXRlLWZpbGUiLCJ3b3JrX3BhY2thZ2VfaWQiOiIifX0sInJlcXVpcmVzX3JldmlldyI6dHJ1ZSwicmV2aWV3ZXJfYWdlbnRfaWQiOiJ3YXZlLTExLWh1bWFuLXJldmlldyIsInN0YXR1cyI6InJlcXVpcmVfcmV2aWV3In0sImFsbG93ZWQiOmZhbHNlLCJkZWNpZGVkX2F0IjoiMjAyNi0wOS0zMFQyMDoyOTo1Mi4zMjIzNDIrMDA6MDAiLCJkaWdlc3QiOiJmZjA5NDFkN2NlYjFlZTMxNzk0YzJjNDNmYzU0ZjgwMGU3ZDVjZWVjMzMxNzQyYmEzMzkzZjE3MzZmOGMyZTZhIiwiZXZpZGVuY2UiOnsiaHVtYW5fYXBwcm92YWxfc2F0aXNmaWVkIjpmYWxzZSwiaXNzdWVfY291bnQiOjEsImlzc3VlcyI6W3siY29kZSI6InJlcXVpcmVkX2V2aWRlbmNlX21pc3NpbmciLCJldmlkZW5jZV9pZCI6IiIsIm1ldGFkYXRhIjp7fSwic3VtbWFyeSI6IlJlcXVpcmVkIGV2aWRlbmNlIGtpbmQgaXMgbWlzc2luZyBvciBpbnZhbGlkOiB0ZXN0X3Jlc3VsdC4ifV0sIm1pc3Npbmdfa2luZHMiOlsidGVzdF9yZXN1bHQiXSwicGFzc2VkIjpmYWxzZSwicG9saWN5X2lkIjoicHJvdGVjdGVkLXdyaXRlIiwicmVxdWlyZWRfa2luZHMiOlsidGVzdF9yZXN1bHQiXSwidmFsaWRfZXZpZGVuY2VfaWRzIjpbXSwidmVyaWZpY2F0aW9uX2NvdW50IjowLCJ2ZXJpZmljYXRpb25zIjpbXX0sInJlYXNvbl9jb2RlcyI6WyJldmlkZW5jZV9jb25kaXRpb25zX3Vuc2F0aXNmaWVkIl0sInNjaGVtYV92ZXJzaW9uIjoid2F2ZTE0LmxpdmVfYXV0aG9yaXR5X2RlY2lzaW9uLnYxIiwic3RhdHVzIjoiZXZpZGVuY2VfcmVxdWlyZWQiLCJzdWJqZWN0Ijp7ImFnZW50X2lkIjoiY29kaW5nLWFnZW50LTA3IiwiYXJndW1lbnRzX2RpZ2VzdCI6ImUwMGQzOWI1MjMyOGFiODU0MTBjMmQ2ZDUyMzA5Nzk4MGQxNzUyZTIwOTYxZDE2NzhkM2VhMTljZGRkMGNkNGMiLCJhdXRob3JpdHlfY29udGV4dF9kaWdlc3QiOiJjNGYyM2IyZTMwZTM4OWYxNmUwMjgzMTYzMzQ2YWRlNGU4NDJkZjBiMzFlY2Y5MmZhMDMzZDlkNzIxOTk1NTkwIiwiY2FwYWJpbGl0eSI6ImZpbGVfd3JpdGUiLCJkaWdlc3QiOiJiODQ5MzJhNTNiOWY1MDNhZWU0Yzk1YmY0OTEyZDg4ZTVlNDRkMjE0MjNkODc1ZWRlNTVhOWI0YTc5YWI5MjM2IiwibWV0YWRhdGEiOnsiYXV0aGVudGljYXRpb25fdHlwZSI6Im9pZGNfand0IiwiZXZpZGVuY2VfcG9saWN5X2lkIjoicHJvdGVjdGVkLXdyaXRlIiwiaWRlbnRpdHlfY29udGV4dF9kaWdlc3QiOiIyYmE4OWQxZjE0MGE5M2U4ZjExMDM0NDZkYzE4YmFmOGMxZDg0MDcwOWUyODEwZjY1YjlhYWViMjg4YzU4MGE4In0sInBhdGgiOiJkb2NzL21pc3NpbmcudHh0IiwicHJvdG9jb2wiOiJibGFja2ZveC1hcGkvdjEiLCJyZXBvc2l0b3J5X2lkIjoiaXgtYmxhY2tmb3giLCJyZXZpc2lvbiI6IndhdmUxNi1yZXZpc2lvbiIsInNjaGVtYV92ZXJzaW9uIjoid2F2ZTE0LmF1dGhvcml0eV9zdWJqZWN0LnYxIiwidG9vbF9uYW1lIjoiZmlsZXN5c3RlbS53cml0ZV9maWxlIn19LCJkZXBsb3ltZW50X2lkIjoid2F2ZTE2LWxvY2FsLWRlbW8iLCJldmFsdWF0ZWRfZXZpZGVuY2VfZGlnZXN0cyI6e30sImV2aWRlbmNlX3JlZnMiOltdLCJleGVjdXRlZCI6ZmFsc2UsImV4ZWN1dGlvbl9zdGF0ZSI6Im5vdF9hdHRlbXB0ZWQiLCJwcmV2aW91c19yZWNlaXB0X2RpZ2VzdCI6ImFjZGIxOTc5NTE4YjI1ODNhY2MwN2MyNWYwMDEwMjAzZjNkMjljZWRhYzQ3NjM0ZDRkYmNkMTQ4YmIwY2Y2ZDEiLCJwcm90b2NvbCI6ImJsYWNrZm94LWFwaS92MSIsInJlY2VpcHRfZGlnZXN0IjoiODNmMDY5ZDhhMjM4ZThlNTNlZGE2MjdjNTE5M2U5M2NkZjcyMTJjMjBmYzYzY2RlNWQwZGY1MGYxNGE5NWFjOCIsInJlY2VpcHRfaWQiOiJ3YXZlMTYtcmVjZWlwdC00NjA0YmJjYzQ4MzM4YzZiMWNhYTlmN2E2NWYwOWM0OWY1YzM4OWFmMGNmZjYxZGFiZGZiMTE2YmI1OWU3NTg3IiwicmVjb3JkX3R5cGUiOiJkZW5pYWwiLCJyZWNvcmRlZF9hdCI6IjIwMjYtMDktMzBUMjA6Mjk6NTIuMzIyNTI2KzAwOjAwIiwic2NoZW1hX3ZlcnNpb24iOiJ3YXZlMTYuYXV0aG9yaXR5X3JlY2VpcHQudjEiLCJzZXF1ZW5jZSI6Miwic2luZ2xlX3VzZV9ldmlkZW5jZV9jbGFpbXMiOltdLCJzdHJlYW1faWQiOiJ3YXZlMTYtZGVtby1zdHJlYW0iLCJzdWJqZWN0Ijp7ImFnZW50X2lkIjoiY29kaW5nLWFnZW50LTA3IiwiYXJndW1lbnRzX2RpZ2VzdCI6ImUwMGQzOWI1MjMyOGFiODU0MTBjMmQ2ZDUyMzA5Nzk4MGQxNzUyZTIwOTYxZDE2NzhkM2VhMTljZGRkMGNkNGMiLCJhdXRob3JpdHlfY29udGV4dF9kaWdlc3QiOiJjNGYyM2IyZTMwZTM4OWYxNmUwMjgzMTYzMzQ2YWRlNGU4NDJkZjBiMzFlY2Y5MmZhMDMzZDlkNzIxOTk1NTkwIiwiY2FwYWJpbGl0eSI6ImZpbGVfd3JpdGUiLCJkaWdlc3QiOiJiODQ5MzJhNTNiOWY1MDNhZWU0Yzk1YmY0OTEyZDg4ZTVlNDRkMj